{"$schema":"https://json-schema.org/draft/2020-12/schema","$id":"checkpoint-5b-qa.schema.json","type":"object","additionalProperties":false,"required":["schema_version","qa_id","aggregate_status","checks","capability_state_distribution","evidence_level_distribution"],"properties":{"schema_version":{"const":"1.0.0"},"qa_id":{"const":"CP5B-QA-001"},"aggregate_status":{"enum":["pass","fail","block"]},"checks":{"type":"array","minItems":1,"items":{"type":"object","additionalProperties":false,"required":["check_id","status"],"properties":{"check_id":{"type":"string"},"status":{"enum":["pass","fail","block"]},"record_count":{"type":"integer"},"unknown_svg_legal":{"type":"boolean"}}}},"capability_state_distribution":{"type":"object","additionalProperties":{"type":"integer"}},"evidence_level_distribution":{"type":"object","additionalProperties":{"type":"integer"}}}}
